<?xml version="1.0" encoding="UTF-8"?>
<xs:schema xmlns:xs="http://www.w3.org/2001/XMLSchema" elementFormDefault="qualified" attributeFormDefault="unqualified">
	<xs:element name="library">
		<xs:complexType>
			<xs:sequence>
				<xs:element name="librarian"/>
				<xs:element name="book" minOccurs="1" maxOccurs="2">
					<xs:complexType>
						<xs:sequence>
							<xs:element name="preface"/>
							<xs:element name="parts" minOccurs="1" maxOccurs="unbounded">
								<xs:complexType>
									<xs:sequence>
										<xs:element name="chapter" minOccurs="1" maxOccurs="unbounded">
											<xs:complexType>
												<xs:sequence>
													<xs:element name="summary"/>
													<xs:element name="sections">
														<xs:complexType>
															<xs:sequence>
																<xs:element name="content"/>
															</xs:sequence>
														</xs:complexType>
													</xs:element>
												</xs:sequence>
												<xs:attribute name="title" type="xs:string"/>
											</xs:complexType>
										</xs:element>
									</xs:sequence>
									<xs:attribute name="title" type="xs:string"/>
								</xs:complexType>
							</xs:element>
						</xs:sequence>
						<xs:attribute name="title" type="xs:string"/>
						<xs:attribute name="ISBN" type="xs:integer"/>
						<xs:attribute name="Auther" type="xs:string"/>
					</xs:complexType>
				</xs:element>
			</xs:sequence>
			<xs:attribute name="location" type="xs:string"/>
			<xs:attribute name="description" type="xs:string"/>
		</xs:complexType>
	</xs:element>
</xs:schema>
